{
  "schema_version": "agent-bom.mcp-protocol-compatibility.v2",
  "scope": "Evidence for the agent-bom MCP server, introspection client, runtime proxy, runtime gateway, and absent API/UI compatibility surfaces. This is not an official MCP conformance certification.",
  "official_protocol": {
    "current_revision": "2026-07-28",
    "immutable_revision": "2026-07-28",
    "source_url": "https://modelcontextprotocol.io/specification/2026-07-28/changelog",
    "retrieved_at": "2026-09-04"
  },
  "sdk_policy": {
    "dependency_constraint": "mcp>=1.26,<2",
    "locked_distribution": "mcp",
    "locked_version": "1.30.0",
    "latest_protocol_supported_by_locked_sdk": "2025-11-25",
    "protocol_versions_supported_by_locked_sdk": [
      "2024-11-05",
      "2025-03-26",
      "2025-06-18",
      "2025-11-25"
    ]
  },
  "official_conformance_suite": {
    "status": "not_run",
    "outcome": "unavailable"
  },
  "features": [
    {
      "feature_id": "server.stdio.handshake_and_inventory",
      "role": "server",
      "surface": "mcp_server",
      "transport": "stdio",
      "protocol_version": "2025-11-25",
      "implementation_state": "implemented",
      "conformance_state": "conformant",
      "assessment_status": "complete",
      "lifecycle": "active",
      "evidence_basis": ["live_wire", "executable_contract"],
      "evidence_refs": [
        {
          "kind": "executable_test",
          "ref": "tests/test_mcp_protocol_compatibility.py::test_locked_sdk_stdio_wire_contract",
          "outcome": "passed"
        }
      ],
      "evidence_outcome": "passed",
      "reason_codes": []
    },
    {
      "feature_id": "server.streamable_http.handshake_and_inventory",
      "role": "server",
      "surface": "mcp_server",
      "transport": "streamable_http",
      "protocol_version": "2025-11-25",
      "implementation_state": "implemented",
      "conformance_state": "conformant",
      "assessment_status": "complete",
      "lifecycle": "active",
      "evidence_basis": ["live_wire", "executable_contract"],
      "evidence_refs": [
        {
          "kind": "executable_test",
          "ref": "tests/test_mcp_protocol_compatibility.py::test_locked_sdk_streamable_http_wire_contract",
          "outcome": "passed"
        }
      ],
      "evidence_outcome": "passed",
      "reason_codes": []
    },
    {
      "feature_id": "server.sse.transport",
      "role": "server",
      "surface": "mcp_server",
      "transport": "sse",
      "protocol_version": "2025-11-25",
      "implementation_state": "partial",
      "conformance_state": "unverified",
      "assessment_status": "partial",
      "lifecycle": "deprecated",
      "evidence_basis": ["static_code", "official_spec"],
      "evidence_refs": [
        {"kind": "source", "ref": "src/agent_bom/cli/_server.py", "outcome": "reviewed"},
        {
          "kind": "official_spec",
          "ref": "https://modelcontextprotocol.io/specification/2026-07-28/changelog",
          "outcome": "reviewed"
        }
      ],
      "evidence_outcome": "unverified",
      "reason_codes": ["wire_test_not_run", "transport_deprecated_upstream"]
    },
    {
      "feature_id": "introspection.remote.authenticated",
      "role": "introspection_client",
      "surface": "mcp_introspection",
      "transport": "streamable_http",
      "protocol_version": "2025-11-25",
      "implementation_state": "not_implemented",
      "conformance_state": "nonconformant",
      "assessment_status": "complete",
      "lifecycle": "active",
      "evidence_basis": ["static_code"],
      "evidence_refs": [
        {"kind": "source", "ref": "src/agent_bom/mcp_introspect.py", "outcome": "observed_nonconformance"}
      ],
      "evidence_outcome": "observed_nonconformance",
      "reason_codes": ["operator_auth_headers_not_supported"]
    },
    {
      "feature_id": "server.oauth.authorization_server.2025",
      "role": "server",
      "surface": "mcp_server",
      "transport": "http",
      "protocol_version": "2025-11-25",
      "implementation_state": "not_implemented",
      "conformance_state": "nonconformant",
      "assessment_status": "partial",
      "lifecycle": "active",
      "evidence_basis": ["live_wire", "executable_contract", "static_code", "official_spec"],
      "evidence_refs": [
        {
          "kind": "executable_test",
          "ref": "tests/test_mcp_protocol_compatibility.py::test_embedded_oauth_is_disabled_until_trusted_authorization_exists",
          "outcome": "passed"
        },
        {"kind": "source", "ref": "src/agent_bom/mcp_server_factory.py", "outcome": "observed_nonconformance"},
        {
          "kind": "official_spec",
          "ref": "https://modelcontextprotocol.io/specification/2025-11-25/basic/authorization",
          "outcome": "reviewed"
        }
      ],
      "evidence_outcome": "observed_nonconformance",
      "reason_codes": ["embedded_mcp_authorization_server_disabled", "trusted_client_authorization_not_implemented"]
    },
    {
      "feature_id": "proxy.session_era.forwarding",
      "role": "proxy",
      "surface": "runtime_proxy",
      "transport": "transport_agnostic",
      "protocol_version": "2025-11-25",
      "implementation_state": "partial",
      "conformance_state": "unverified",
      "assessment_status": "partial",
      "lifecycle": "active",
      "evidence_basis": ["static_code"],
      "evidence_refs": [
        {"kind": "source", "ref": "src/agent_bom/proxy.py", "outcome": "reviewed"}
      ],
      "evidence_outcome": "unverified",
      "reason_codes": ["wire_conformance_not_run"]
    },
    {
      "feature_id": "gateway.session_era.forwarding",
      "role": "gateway",
      "surface": "runtime_gateway",
      "transport": "http",
      "protocol_version": "2025-11-25",
      "implementation_state": "partial",
      "conformance_state": "unverified",
      "assessment_status": "partial",
      "lifecycle": "active",
      "evidence_basis": ["static_code"],
      "evidence_refs": [
        {"kind": "source", "ref": "src/agent_bom/gateway_server.py", "outcome": "reviewed"}
      ],
      "evidence_outcome": "unverified",
      "reason_codes": ["wire_conformance_not_run"]
    },
    {
      "feature_id": "api.compatibility_contract",
      "role": "server",
      "surface": "api",
      "transport": "not_applicable",
      "protocol_version": "not_applicable",
      "implementation_state": "not_implemented",
      "conformance_state": "not_applicable",
      "assessment_status": "unavailable",
      "lifecycle": "not_applicable",
      "evidence_basis": ["not_assessed"],
      "evidence_refs": [],
      "evidence_outcome": "unavailable",
      "reason_codes": ["no_api_exposure"]
    },
    {
      "feature_id": "ui.compatibility_contract",
      "role": "server",
      "surface": "ui",
      "transport": "not_applicable",
      "protocol_version": "not_applicable",
      "implementation_state": "not_implemented",
      "conformance_state": "not_applicable",
      "assessment_status": "unavailable",
      "lifecycle": "not_applicable",
      "evidence_basis": ["not_assessed"],
      "evidence_refs": [],
      "evidence_outcome": "unavailable",
      "reason_codes": ["no_ui_exposure"]
    },
    {
      "feature_id": "server.2026.stateless_requests",
      "role": "server",
      "surface": "mcp_server",
      "transport": "streamable_http",
      "protocol_version": "2026-07-28",
      "implementation_state": "not_implemented",
      "conformance_state": "nonconformant",
      "assessment_status": "partial",
      "lifecycle": "active",
      "evidence_basis": ["live_wire", "executable_contract", "official_spec"],
      "evidence_refs": [
        {"kind": "executable_test", "ref": "tests/test_mcp_protocol_compatibility.py::test_2026_server_discover_is_rejected_by_session_era_server", "outcome": "passed"},
        {"kind": "official_spec", "ref": "https://modelcontextprotocol.io/specification/2026-07-28/changelog", "outcome": "reviewed"}
      ],
      "evidence_outcome": "observed_nonconformance",
      "reason_codes": ["session_id_required_by_current_server"]
    },
    {
      "feature_id": "server.2026.server_discover",
      "role": "server",
      "surface": "mcp_server",
      "transport": "streamable_http",
      "protocol_version": "2026-07-28",
      "implementation_state": "not_implemented",
      "conformance_state": "nonconformant",
      "assessment_status": "partial",
      "lifecycle": "active",
      "evidence_basis": ["live_wire", "executable_contract", "official_spec"],
      "evidence_refs": [
        {"kind": "executable_test", "ref": "tests/test_mcp_protocol_compatibility.py::test_2026_server_discover_is_rejected_by_session_era_server", "outcome": "passed"},
        {"kind": "official_spec", "ref": "https://modelcontextprotocol.io/specification/2026-07-28/changelog", "outcome": "reviewed"}
      ],
      "evidence_outcome": "observed_nonconformance",
      "reason_codes": ["method_rejected_before_dispatch"]
    },
    {
      "feature_id": "server.2026.no_initialize",
      "role": "server",
      "surface": "mcp_server",
      "transport": "transport_agnostic",
      "protocol_version": "2026-07-28",
      "implementation_state": "not_implemented",
      "conformance_state": "nonconformant",
      "assessment_status": "partial",
      "lifecycle": "active",
      "evidence_basis": ["live_wire", "executable_contract", "official_spec"],
      "evidence_refs": [
        {"kind": "executable_test", "ref": "tests/test_mcp_protocol_compatibility.py::test_2026_server_discover_is_rejected_by_session_era_server", "outcome": "passed"},
        {"kind": "official_spec", "ref": "https://modelcontextprotocol.io/specification/2026-07-28/changelog", "outcome": "reviewed"}
      ],
      "evidence_outcome": "observed_nonconformance",
      "reason_codes": ["initialize_required_by_locked_sdk"]
    },
    {
      "feature_id": "server.2026.no_session_id",
      "role": "server",